<?xml version="1.0" encoding="UTF-8"?>
<!ELEMENT students (student+)>
<!ELEMENT student (number,name,e-mail,marks,class)>
<!ELEMENT number (#PCDATA)>
<!ELEMENT name (#PCDATA)>
<!ELEMENT e-mail (#PCDATA)>
<!ELEMENT marks (#PCDATA)>
<!ELEMENT class  (#PCDATA)>
